id,nome,descricao,numero_de_funcionarios
1,Financeiro,"O departamento financeiro é aquele que administra os recursos de uma empresa. Ele faz o controle da tesouraria, dos investimentos e dos riscos, além do planejamento financeiro da companhia e da divulgação de seus resultados.",20
2,Administrativo,"O departamento administrativo de uma empresa pode ser considerado o coração organizacional ou até mesmo o cérebro da máquina empreendedora. Essa é a área que detém a visão geral do negócio e o faz funcionar. Ou seja, ela representa a base da empresa e garante o ritmo e a sustentabilidade para o dia-a-dia da operação.",12
3,Ensino,"O departamento de ensino de uma empresa é aquele responsável por disponibilizar o material para o aluno,além de conter pessoas capacitadas para ensinar e auxiliar na evolução pessoal e interpessoal do estudante.",8
4,Recursos Humanos,"O departamento de RH (recursos humanos) é responsável por gerenciar o ciclo de vida dos funcionários (ou seja, recrutar, contratar, integrar, treinar e demitir funcionários), além de administrar seus benefícios.",7
5,TI,"O departamento de Tecnologia de Informação, ou simplesmente TI, é o setor responsável por manter o bom desenvolvimento técnico de toda a área tecnológica dentro de uma empresa. Por isso, é extremamente importante não apenas nas organizações de grande porte, mas também nas de pequeno e médio.",14
